{
  "contractVersion": "validation-diagnostic@0.1.0",
  "schemaId": "validation-diagnostic",
  "schemaVersion": 1,
  "status": "fatal",
  "diagnostics": [
    {
      "contractVersion": "validation-diagnostic@0.1.0",
      "schemaId": "validation-diagnostic",
      "schemaVersion": 1,
      "code": "ATOMICITY_VIOLATION",
      "severity": "fatal",
      "category": "internal",
      "phase": "commit",
      "message": "The committed boundary was violated."
    }
  ]
}
