{
  "contractVersion": "validation-diagnostic@0.1.0",
  "schemaId": "validation-diagnostic",
  "schemaVersion": 1,
  "diagnosticId": "validation-diagnostic.runtime.metadata",
  "code": "VALIDATION_NOTE",
  "severity": "info",
  "category": "validation",
  "phase": "explain",
  "message": "Metadata is safe.",
  "metadata": {
    "mode": "explain",
    "origin": "authoring",
    "tags": ["review", "diagnostic"]
  }
}
