{
  "contractVersion": "validation-diagnostic@0.1.0",
  "schemaId": "validation-diagnostic",
  "schemaVersion": 1,
  "status": "valid-with-warnings",
  "diagnostics": [
    {
      "contractVersion": "validation-diagnostic@0.1.0",
      "schemaId": "validation-diagnostic",
      "schemaVersion": 1,
      "code": "VALIDATION_NOTE",
      "severity": "info",
      "category": "validation",
      "phase": "explain",
      "message": "Explain mode is active."
    },
    {
      "contractVersion": "validation-diagnostic@0.1.0",
      "schemaId": "validation-diagnostic",
      "schemaVersion": 1,
      "code": "DIAGNOSTIC_OUTPUT_TRUNCATED",
      "severity": "warning",
      "category": "budget",
      "phase": "validation",
      "message": "Some diagnostics were omitted."
    }
  ]
}
