{
  "contractVersion": "validation-diagnostic@0.1.0",
  "schemaId": "validation-diagnostic",
  "schemaVersion": 1,
  "diagnosticId": "validation-diagnostic.runtime.source-reference",
  "code": "ACCESS_DENIED",
  "severity": "error",
  "category": "authorization",
  "phase": "authorization",
  "message": "The request is not authorized.",
  "source": {
    "kind": "transaction",
    "id": "transaction.runtime.open-main-door"
  }
}
