{
  "contractVersion": "validation-diagnostic@0.1.0",
  "schemaId": "validation-diagnostic",
  "schemaVersion": 1,
  "code": "INVALID_LOCATION",
  "severity": "error",
  "category": "reference",
  "phase": "reference-validation",
  "message": "Schema location is invalid.",
  "location": {
    "kind": "schema",
    "schemaId": "schemas/effect.schema.json",
    "path": "/properties/target"
  }
}
