{
  "contractVersion": "validation-diagnostic@0.1.0",
  "schemaId": "validation-diagnostic",
  "schemaVersion": 1,
  "code": "INVALID_TARGET",
  "severity": "error",
  "category": "reference",
  "phase": "reference-validation",
  "message": "The target reference cannot be resolved.",
  "related": [
    {
      "relation": "conflicts-with",
      "kind": "command",
      "id": "command.runtime.other"
    }
  ]
}
